Article Class,Article Titles,List of Article Author Names
Review Article,Knee intra-articular extraskeletal aneurysmal bone cyst: a case report and review of literature,Noam OlshinkaYusef AzraqOmer Or
Review Article,Imaging of shoulder instability,Massimo De FilippoSilvia SchiròAlessandro Castagna
Review Article,Bone health of transgender adults: what the radiologist needs to know,Justin T. StowellHillary W. GarnerRupert O. Stanborough
Scientific Article,Psoas muscle atrophy following unilateral hip arthroplasty,D. MakC. ChisholmS. L. James
Scientific Article,Impact of fluoroscopic injection location on immediate and delayed pain relief in patients with greater trochanteric pain syndrome,Lisa J. MaoJohn B. CrudupNicholas C. Nacey
Scientific Article,Effect of elbow MRI with axial traction on articular cartilage visibility—a feasibility study,Sho KohyamaToshikazu TanakaNaoyuki Ochiai
Scientific Article,Traumatic injury of the triangular fibrocartilage complex (TFCC)—a refinement to the Palmer classification by using high-resolution 3-T MRI,Huili ZhanRongjie BaiYuming Yin
Scientific Article,Comparison between radiography and magnetic resonance imaging for the detection of sacroiliitis in the initial diagnosis of axial spondyloarthritis: a cost-effectiveness study,Natalia GorelikFarah TamizuddinSoterios Gyftopoulos
Scientific Article,Diagnostic performance of dual-energy computed tomography for detection of acute spinal fractures,Soo-Yeon JeongSe-Jeong JeonSeon Kwan Juhng
Scientific Article,Comparative analysis of the diagnostic values of T2 mapping and diffusion-weighted imaging for sacroiliitis in ankylosing spondylitis,Dongdong WangHuijia YinDongming Han
Scientific Article,The prevalence and characteristics of osseous erosions associated with parameniscal cysts on knee MRI,Olaitan OgunkinleKawan S RakhraZaid Jibri
Scientific Article,Asymmetric lambda sign of the second tarsometatarsal joint on axial weight-bearing cone-beam CT scans of the foot: preliminary investigation for diagnosis of subtle ligamentous Lisfranc injuries in a cadaveric model,Yantarat SripanichJesse SteadmanAlexej Barg
Scientific Article,Automated detection and classification of shoulder arthroplasty models using deep learning,Paul H. YiTae Kyung KimJan Fritz
Scientific Article,3D mapping of scaphoid fractures and comminution,Arthur TurowAnne Eva BulstraGregory I. Bain
Technical Report,Correlation between muscle mass and quality around the hip and of psoas muscles at L3 level using unenhanced CT scans,Stefania ZannoniDomenico AlbanoLuca Maria Sconfienza
Test Yourself: Question,Test yourself question: fullness in the left axilla,R RajakulasingamA Saifuddin
Case Report,A rare case of isolated traumatic avulsion of the pes anserinus tendon,Sisith P. AriyaratneRichard ClarnetteWilliam K Loftus
Case Report,The G2 research R.I.P. fragmenting bullet—radiographic features of a recently encountered projectile,Gregory Scott StacyStephen Thomas
Case Report,Slow-growing buttock mass after failure of incorporation of autologous fat transfer for gluteal augmentation: ultrasound and MRI features,Venkat MasarapuPeter S. WangTetyana Gorbachova
Test Yourself: Answer,Fullness in the left axilla—answer: Langer’s axillary arch,Ramanan RajakulasingamAsif Saifuddin
Letter to the Editor,"Langer’s axillary arch—a term used through the years, but is it correct?",Georgi P. Georgiev
Browser's Notes,Browser’s Notes,
Abstracts,"Abstracts of the International Skeletal Society (ISS) 2020, Virtual Meeting Supplement",
