2020-Dec,Scientific Article,Comparison of 3D X-ray tomography with computed tomography in patients with distal extremity fractures,"Anna L. Falkowski,Balazs K. Kovacs,Anna Hirschmann",Anna L. Falkowski,Anna Hirschmann
2020-Dec,Scientific Article,"Painful type II os naviculare: introduction of a standardized, reproducible classification system","Sarah I. Kamel,Jeffrey A. Belair,Adam C. Zoga",Sarah I. Kamel,Adam C. Zoga
2020-Dec,Scientific Article,Using a simplified version of a common surgical grading scale for acetabular labral tears improves the utility of preoperative hip MRI for femoroacetabular impingement,"Patrick Morgan,Amanda Crawford,Jutta M. Ellermann",Patrick Morgan,Jutta M. Ellermann
2020-Dec,Scientific Article,Radiofrequency ablation vs microwave ablation for osteoid osteomas: long-term results,"Joseph Reis,Young Chang,Ashwani K. Sharma",Joseph Reis,Ashwani K. Sharma
2020-Dec,Scientific Article,Impact of stem design and cementation on postoperative femoral antetorsion in 227 patients with total hip arthroplasty (THA),"Tim Fischer,Christoph Stern,Reto Sutter",Tim Fischer,Reto Sutter
2020-Dec,Review Article,Hallux sesamoid complex imaging: a practical diagnostic approach,"Charles Lombard,Romain Gillet,Pedro Gondim Teixeira",Charles Lombard,Pedro Gondim Teixeira
2020-Dec,Technical Report,MR spectroscopy differences between lipomatosis of nerve and neuromuscular choristoma: a potential adjunctive diagnostic tool,"T. Marek,K. K. Amrami,J. D. Port",T. Marek,J. D. Port
2020-Dec,Review Article,Microinstability of the hip: a systematic review of the imaging findings,"Rebecca M Woodward,Renuka M Vesey,Donna G Blankenbaker",Rebecca M Woodward,Donna G Blankenbaker
