Article Class,Article Titles,List of Article Author Names
Perspective,Incorporation of musculoskeletal ultrasound training into the radiology core curriculum,Netanel S. BerkoJenna N. LeMordecai Koenigsberg
Review Article,Post-operative extra-spinal etiologies of sciatic nerve impingement,Jonathan A. FlugAlissa BurgeJohn A. Carrino
Review Article,Multimodality imaging of subacromial impingement syndrome,Lionel PesquerSophie BorgholPierre Abadie
Scientific Article,Is a single-level measurement of paraspinal muscle fat infiltration and cross-sectional area representative of the entire lumbar spine?,Julio UrrutiaPablo BesaSergio Uribe
Scientific Article,Texture analysis of paraspinal musculature in MRI of the lumbar spine: analysis of the lumbar stenosis outcome study (LSOS) data,Manoj MannilJakob M. BurgstallerRoman Guggenberger
Scientific Article,"Lumbar paraspinal muscle fat infiltration is independently associated with sex, age, and inter-vertebral disc degeneration in symptomatic patients",Julio UrrutiaPablo BesaSergio Uribe
Scientific Article,Hand MRI and the Greulich-Pyle atlas in skeletal age estimation in adolescents,Azadeh HojrehJutta GamperIris-Melanie Noebauer-Huhmann
Scientific Article,Feasibility of using an inversion-recovery ultrashort echo time (UTE) sequence for quantification of glenoid bone loss,Ya-jun MaJustin WestEric Y. Chang
Scientific Article,Prevalence of vitamin D insufficiency in radiologists: a cross-sectional study,Christoph Amadeus AgtenLukas MargaroliChristian W.A. Pfirrmann
Technical Report,MRI sport-specific pulley imaging,Michael N. HoffTodd D. Greenberg
Test Yourself: Question,Abnormal alignment of the left lower extremity and irregular gait,Pamela WalshLynne PinkneyMohammad Samim
Case Report,Anaplastic plasmacytoma: a rare tumor presenting as a pathological fracture in a younger adult,Robert W. MorrisVarsha KumarAli G. Saad
Case Report,Bladder cancer presenting with acrometastases: a different cause of foot pain,João MatosIlaria MussettoNicoletta Gandolfo
Case Report,Interposition of the transverse ligament of the knee into a fracture of the tibial plateau: a case report,Kazimierz T. SzopinskiPawel Adamczyk
Case Report,Multicentric carpotarsal osteolysis syndrome: long-term follow-up of three patients,Céline KleinJonathan BellityStéphanie Pannier
Case Report,Superficial acral fibromyxoma: a case report with radiological review,Shirly LeeMichael Austin Ross Reid
Case Report,Epiphyseal hyperplasia caused by an ectopic ossification center of the distal tibia: presentation of a pediatric case with 13 years of radiological surveillance,Susanne ScheiplStefan TauberGerhard Ranner
Test Yourself: Answer,Abnormal alignment of the left lower extremity and irregular gait,Pamela WalshLynne PinkneyMohammad Samim
Browser's Notes,Browser’s Notes,
