Date,Article Class,Article Titles,List of Article Author Names,First Author,Last Author
2018-May,Announcement,2017 Award Winning Papers,"Shadi Khalil,Mohamad G. Al-Rahawan,Mohamad M. Al-Rahawan",Shadi Khalil,Mohamad M. Al-Rahawan
2018-May,Letter to the editor,Periosteal mesenchymal chondrosarcoma of the tibia,Rajendra Kumar,Rajendra Kumar,Rajendra Kumar
2018-May,Letter to the editor,Response to: Periosteal mesenchymal chondrosarcoma of the tibia,"Christine Ojango,Mario Raguso,Salvatore Masala",Christine Ojango,Salvatore Masala
2018-May,Review Article,Pulse-dose radiofrequency treatment in pain management—initial experience,"Steven P. Daniels,Jelle P. van der List,Gregory S. Di,Felice",Steven P. Daniels,Felice
2018-May,Review Article,Arthroscopic primary repair of the anterior cruciate ligament: what the radiologist needs to know,"Nicola Krähenbühl,Maxwell W. Weinberg,Alexej Barg",Nicola Krähenbühl,Alexej Barg
2018-May,Scientific Article,Imaging in syndesmotic injury: a systematic literature review,"Emmanuel Ducouret,Gilles Reboul,Benjamin Dallaudiere",Emmanuel Ducouret,Benjamin Dallaudiere
2018-May,Scientific Article,MRI in chronic groin pain: sequence diagnostic reliability compared to systematic surgical assessment,"I-Yuan Joseph Chang,Hakan Ilaslan,Naveen Subhas",I-Yuan Joseph Chang,Naveen Subhas
2018-May,Scientific Article,CT-guided percutaneous biopsy of sclerotic bone lesions: diagnostic outcomes,"Carly A. Lockard,Katharine J. Wilson,Peter J. Millett",Carly A. Lockard,Peter J. Millett
2018-May,Scientific Article,Quantitative mapping of glenohumeral cartilage in asymptomatic subjects using 3 T magnetic resonance imaging,"Frederiek Laloo,N. Herregods,L. Jans",Frederiek Laloo,L. Jans
2018-May,Scientific Article,MRI of the sacroiliac joints in spondyloarthritis: the added value of intra-articular signal changes for a ‘positive MRI’,"Ayano Tachibana,Nikhil Kotnis",Ayano Tachibana,Nikhil Kotnis
2018-May,Test Yourself: Question,Test yourself: weakness and wasting of forearm,"Omar M. Albtoush,Abtehag A. Taib,Fabian Springer",Omar M. Albtoush,Fabian Springer
2018-May,Case Report,Avulsion fracture of an ossified pes anserinus tendon post-lateral patellar dislocation,"Daniel C. Ramirez,Sinchun Hwang,Meera Hameed",Daniel C. Ramirez,Meera Hameed
2018-May,Case Report,Atypical lipomatous tumor of the hand with transformation to dedifferentiated liposarcoma: a case report,"Deepika Savant,Shachar Kenan,Leonard Kahn",Deepika Savant,Leonard Kahn
2018-May,Case Report,Osteogenic melanoma: report of a case mimicking osteosarcoma and review of the literature,"Sujin Kim,Geun Young Lee,Yong Chan Ha",Sujin Kim,Yong Chan Ha
2018-May,Case Report,"An intra-articular synovial lipoma of the hip, possibly causing osteoarthritis: a case report and review of the literature","Mohamed Ali Kedous,Ahmed Msakni,Mohsen Trabelsi",Mohamed Ali Kedous,Mohsen Trabelsi
2018-May,Case Report,Unusual circumstances to diagnose cervical Pott’s disease,"Sang Min Lee,Doo Hoe Ha,Ji Young Rho",Sang Min Lee,Ji Young Rho
2018-May,Case Report,Intraarticular calcifying aponeurotic fibroma of the wrist: mimicking gout or calcium pyrophosphate dihydrate deposition disease,"Hee Young Choi,Min Hee Lee,Kyung-Ja Cho",Hee Young Choi,Kyung-Ja Cho
2018-May,Case Report,Isolated subcutaneous nontuberculous mycobacterial infection: a rare case initially mischaracterized as a soft tissue malignancy,"Maxwell W. Weinberg,Nicola Krähenbühl,Alexej Barg",Maxwell W. Weinberg,Alexej Barg
2018-May,Case Report,Isolated avulsion fracture of the first metatarsal base at the peroneus longus tendon attachment: a case report,"Edgar Leonardo Martinez-Salazar,Joao R. T. Vicentini,Martin Torriani",Edgar Leonardo Martinez-Salazar,Martin Torriani
2018-May,Case Report,Hallux saltans due to stenosing tenosynovitis of flexor hallucis longus: dynamic sonography and arthroscopic findings,"Ayano Tachibana,Nikhil Kotnis",Ayano Tachibana,Nikhil Kotnis
2018-May,Test Yourself: Answer,Test yourself: weakness and wasting of forearm,,,
2018-May,Browser's Notes,Browser’s notes,,,
