Article Class,Article Titles,List of Article Author Names
Perspective,"“Should we measure?” and more importantly, “should we report?” Perspective from an adult orthopaedic deformity surgeon",Francis H. Shen
Review Article,MR and ultrasound of the hands and wrists in rheumatoid arthritis. Part II. Added clinical value,David A. Rubin
Review Article,Surgical management of patellofemoral instability. I. Imaging considerations,Neeraj PurohitNicholas HancockAsif Saifuddin
Scientific Article,Five-year development of lumbar disc degeneration—a prospective study,Elina Iordanova SchistadSiri BjorlandAnsgar Espeland
Scientific Article,Radiofrequency ablation in the treatment of atypical cartilaginous tumours in the long bones: lessons learned from our experience,Edwin F. DierselhuisJelle OverboschPaul C. Jutte
Scientific Article,Iliopsoas snapping hip: improving the diagnostic value of magnetic resonance imaging with a novel parameter,Wajeeh BakhshSean ChildsBrian Giordano
Scientific Article,"CT, conventional, and functional MRI features of skull lymphoma: a series of eight cases in a single institution",Zhen XingHongjie HuangDairong Cao
Scientific Article,Multilevel glenoid morphology and retroversion assessment in Walch B2 and B3 types,Mohammad SamimMandeep VirkSoterios Gyftopoulos
Scientific Article,MRI appearance of the anomalous volar radiotriquetral ligament in true Madelung deformity,Theodore J. HansonNaveen S. MurthyMark S. Collins
Scientific Article,Diabetics show accelerated progression of knee cartilage and meniscal lesions: data from the osteoarthritis initiative,Jan NeumannJulio B. GuimaraesThomas M. Link
Scientific Article,Patterns of cartilage degeneration in knees with medial tibiofemoral offset,Palanan SiriwanarangsunKaren C. ChenChristine B. Chung
Scientific Article,Femoral head subchondral impaction on CT: what does it mean in patients with acetabular fracture?,Pierre-Alexandre PolettiMehmet SahinAlexandra Platon
Scientific Article,Single-shot CT after wrist trauma: impact on detection accuracy and treatment of fractures,Monique BrinkArjan SteenbakkersMathias Prokop
Technical Report,"Ultrasound-guided percutaneous compartment release: a novel technique, proof of concept, and clinical relevance",Joseph DaviesValerie FallonJimmy Kyaw Tun
Case Report,"Intra-articular fibroma-like perivascular epithelioid tumor (PEComa) mimicking tenosynovial giant cell tumor, diffuse type",Joel P. HarveyDavid I. SusterMiriam A. Bredella
Case Report,Radial artery aneurysm secondary to dynamic entrapment by extensor pollicis longus tendon: a case of snapping thumb,Hatim AlabsiThomas GoetzDarra T. Murphy
Case Report,Scurvy: a rare case in an adult,Rajat JoshiCristy N. Gustas-FrenchDonald Flemming
Case Report,Primary osseous sacral neuroblastoma in an adult,Muhammad NaeemHoracio MalufJack W. Jennings
Case Report,Recurrence of carpal tunnel syndrome in isolated non-syndromic macrodactyly: DTI examination of a giant median nerve,Ignazio G. VetranoLuca Maria SconfienzaVittoria Nazzi
Case Report,Scurvy: an unusual complication of paediatric cancer treatment,Iain IrvineTriona WalsheRoisin Hayes
Browser's Notes,Browser’s notes,
