Date,Article Class,Article Titles,List of Article Author Names
2019-Feb,Meeting Highlights,"Highlights of the 22nd Annual Scientific Meeting of the Australasian Musculoskeletal Imaging Group [AMSIG] 2018, Gold Coast, Queensland, Australia",Ryan ShulmanTimothy DicksonMorgan McMeniman
2019-Feb,Meeting Highlights,"Highlights of the special scientific sessions of the 45th Annual Scientific Meeting of the International Skeletal Society (ISS) 2018, Berlin, Germany",Miriam A. Bredella
2019-Feb,Perspective,"Incorporating musculoskeletal ultrasound into your radiology practice: patients, patience, and why your department cannot do without it",Tara A. MorganDaria Motamedi
2019-Feb,Review Article,Instability and impending instability in patients with vertebral metastatic disease,Antonio LeoneAlessandro CianfoniCesare Colosimo
2019-Feb,Review Article,The effects of granulocyte colony-stimulating factor on MR images of bone marrow,Liang GuJohn E. MadewellBilal Mujtaba
2019-Feb,Scientific Article,Preliminary results: use of multi-hole injection nails for intramedullary nailing with simultaneous bone cement injection in long-bone metastasis,Jong Woong ParkYong-il KimHan Soo Kim
2019-Feb,Scientific Article,Can effusion-synovitis measured on ultrasound or MRI predict response to intra-articular steroid injection in hip osteoarthritis?,K. J. D. SteerG. P. BostickJ. L. Jaremko
2019-Feb,Scientific Article,Detecting intertrochanteric hip fractures with orthopedist-level accuracy using a deep convolutional neural network,Takaaki UrakawaYuki TanakaNaoto Endo
2019-Feb,Scientific Article,Incidence of rotator cuff tears in the setting of calcific tendinopathy on MRI: a case controlled comparison,Nicholas M. BeckmannMichael Q. TranChunyan Cai
2019-Feb,Scientific Article,Point vs. traditional method evaluation of hallux valgus: interreader reliability and intermethod performance using X-ray and MRI,Nathan HeinemanAvneesh ChhabraDane Wukich
2019-Feb,Scientific Article,MRI findings for unilateral sternoclavicular arthritis: differentiation between infectious arthritis and spondyloarthritis,Byeong Seong KangHyun Seok ShimMinseo Bang
2019-Feb,Scientific Article,Utility of radial reformation of three-dimensional fat-suppressed multi-echo gradient-recalled-echo images for the evaluation of acetabular labral injuries and femoroacetabular impingement,Takahiro SueokaKeizo TanitameAwai Kazuo
2019-Feb,Scientific Article,Artificial intelligence-assisted interpretation of bone age radiographs improves accuracy and decreases variability,Shahein H. TajmirHyunkwang LeeSynho Do
2019-Feb,Technical Report,Differentiation between malignant and benign musculoskeletal tumors using diffusion kurtosis imaging,Masaki OgawaHirohito KanYuta Shibamoto
2019-Feb,Test Yourself: Question,Post-auricular lump: CT diagnosis,Ying Liang LowSoon Yiew SiaJunwei Zhang
2019-Feb,Case Report,High-pressure injection injury of the hand: peculiar MRI features and treatment implications,Mark CollinsAdam McGauvranBassem Elhassan
2019-Feb,Case Report,Progression of dialysis-related amyloidoma towards pathologic fracture,Joe D. BaalAndrew E. HorvaiThomas M. Link
2019-Feb,Case Report,Malignant granular cell tumor of the median nerve: a case report with a literature review of 157 cases,Shinji TsukamotoMaiko TakedaYasuhito Tanaka
2019-Feb,Case Report,Unusual proximal fragment migration of an os peroneum fracture with associated peroneus longus tendon injury—a tree often hides a forest,Sammy TawkFrédéric LecouvetSouad Acid
2019-Feb,Test Yourself: Answer,Post-auricular lump: CT diagnosis,Ying Liang LowSoon Yiew SiaJunwei Zhang
2019-Feb,Browser's Notes,Browser’s notes,
