Date,Article Class,Article Titles,List of Article Author Names
2022-Nov,Review Article,An update on imaging of tarsal tunnel syndrome,Davoud KhodatarsAnkur GuptaAsif Saifuddin
2022-Nov,Review Article,Complications in image-guided musculoskeletal injections,John P. HynesEoin C. Kavanagh
2022-Nov,Review Article,Ultrasound evaluations and guided procedures of the painful joint arthroplasty,Steven B. SolimanJason J. DavisMarnix T. van Holsbeeck
2022-Nov,Scientific Article,Can images crowdsourced from the internet be used to train generalizable joint dislocation deep learning algorithms?,Jinchi WeiDavid LiPaul H. Yi
2022-Nov,Scientific Article,Automated detection of acute appendicular skeletal fractures in pediatric patients using deep learning,Daichi HayashiAndrew J. KompelAli Guermazi
2022-Nov,Scientific Article,Reliability of reporting differences in degenerative MRI findings of the lumbar spine from the supine to the upright position,Klaus DoktorJan HartvigsenTue Secher Jensen
2022-Nov,Scientific Article,Complications associated with improper palpation-guided iliac bone marrow biopsy tracts identified on follow-up imaging,Mihran KhdhirYara JabbourHicham Moukaddam
2022-Nov,Scientific Article,Shear wave elastography imaging in a porcine tendinopathy model,Grant M. QuillingKenneth S. LeeBeau Ebben
2022-Nov,Scientific Article,Three-dimensional morphological analysis of quadrilateral plate fragments in associated both-column acetabular fractures,Kai YeJianfei TangZhiquan An
2022-Nov,Technical Report,Prospective pre-operative 3-T MR neurography peripheral nerve mapping of upper extremity amputations implanted with FAST-LIFE electrode interfaces of robotic hands: technical report,Bayan MogharrabiJonathan ChengAvneesh Chhabra
2022-Nov,Test Yourself: Question,Elbow pain and clicking,Jun-Li ThamZeid Al-Ani
2022-Nov,Test Yourself: Question,Test Yourself Question: A 44-year-old female presented with a 12-month history of elbow pain,Sharenja JeyabaladevanRamanan RajakulasingamAsif Saifuddin
2022-Nov,Test Yourself: Question,Test Yourself Question: A 69-year-old male presented with a 20-year history of left calf swelling that began following a fall from a tree,Susan HesniMostafa EllatifAsif Saifuddin
2022-Nov,Case Report,Rare malignant melanotic nerve sheath tumors of the upper limb nerves: utility of high-frequency ultrasonography in preoperative imaging,Wenqing GongJing WangDingzhang Chen
2022-Nov,Case report,Localized tenosynovial giant cell tumor: a rare case of snapping hip,Alexander J. VervaeckeHugo DeclercqMathias van den Broek
2022-Nov,Case Report,Concomitant lipoma arborescens and synovial osteochondromatosis of the knee,Sofia TakkalLuis DiazAli Guermazi
2022-Nov,Case Report,Fracture through tracking pin sites following a robotic-assisted total knee arthroplasty,Aliya G. FeroeAmit K. ChakrabortyF. Joseph Simeone
2022-Nov,Case Report,Distant migration of gel filler: imaging findings following breast augmentation,Young Jin ChoiIn Sook LeeHyo Yeong Ahn
2022-Nov,Test Yourself: Answer,Elbow pain and clicking,Jun-Li ThamZeid Al-Ani
2022-Nov,Test Yourself: Answer,Test Yourself Answer To Question: A 44-year-old Female Presented with a 12-month History of Elbow Pain,Sharenja JeyabaladevanRamanan RajakulasingamAsif Saifuddin
2022-Nov,Test Yourself: Answer,Test yourself answer to question: a 69-year-old male presented with a 20-year history of left calf swelling that began following a fall from a tree,Susan HesniMostafa EllatifAsif Saifuddin
